{
 "bnapCases": 1,
 "area": "outcomes",
 "title": "Commit, replay, settle and timeout as state-machine traces",
 "schema": "schema/outcomes.schema.json",
 "generator": "conformance/gen_cases.py",
 "source": "spec/socket-draft-00.md (doc rev 39), spec/ERRATA.md, spec/DECISIONS.md, registry/generated/registry.json, reference/python/bnap_ref.py",
 "numberOfTests": 21,
 "header": [
  "Each case is a trace of operations on one use store (draft-00 6.3 and 6.4). A conformant",
  "store returns, for every step, what that step's expect says. commit returns New, Replay",
  "(with the recorded status), SPENT, RATE_LIMITED or UNAVAILABLE; gate names what the gate",
  "then does. IDs are labels unless the case computes them from the socket formulas. A case",
  "is invalid when its last commit is refused, with that refusal as its error."
 ],
 "notes": {
  "Valid": {
   "bugType": "BASIC",
   "description": "A well-formed input every implementation must accept."
  },
  "Replay": {
   "bugType": "BASIC",
   "description": "The same credential for the same request finds its outcome."
  },
  "Spent": {
   "bugType": "SPENT",
   "description": "A single use ID already committed under another ReplayKey."
  },
  "Abort": {
   "bugType": "BASIC",
   "description": "An aborted commit consumes nothing."
  },
  "Rate": {
   "bugType": "RATE_LIMITED",
   "description": "A counter is full."
  },
  "Once": {
   "bugType": "BASIC",
   "description": "The status changes exactly once, from PENDING, and never flips on replay."
  },
  "Timeout": {
   "bugType": "BASIC",
   "description": "PENDING past pending_timeout becomes FAILED, with counters given back."
  },
  "Purge": {
   "bugType": "BASIC",
   "description": "After replay_window the outcome may go; single uses stay."
  },
  "Unavailable": {
   "bugType": "UNAVAILABLE",
   "description": "The store cannot be reached: fail closed."
  },
  "SharedRail": {
   "bugType": "SPENT",
   "description": "One payment presented through two schemes admits one action."
  },
  "ReceiptOnly": {
   "bugType": "BASIC",
   "description": "The carrier kept no response: the receipt alone, with the recorded scheme_result."
  },
  "Window": {
   "bugType": "POLICY",
   "description": "A credential with no single-use ID whose offer outlives its outcome record. draft-00 names no code for this refusal; POLICY is used, others are acceptable."
  }
 },
 "testGroups": [
  {
   "type": "Trace",
   "section": "6.3",
   "description": "Run the steps in order on one store.",
   "tests": [
    {
     "tcId": 1,
     "comment": "commit, settle OK, then three replays: the same status every time, replayed set",
     "flags": [
      "Replay",
      "Once"
     ],
     "sections": [
      "6.3",
      "6.4"
     ],
     "inputs": {
      "replay_window": 86400,
      "pending_timeout": 300,
      "steps": [
       {
        "op": "commit",
        "at": 1791700100,
        "rk": "rk1",
        "singles": [
         "u1"
        ],
        "expect": {
         "result": "New",
         "gate": "run-action"
        }
       },
       {
        "op": "settle",
        "at": 1791700101,
        "rk": "rk1",
        "status": "OK",
        "response": "kept",
        "expect": {
         "settled": true
        }
       },
       {
        "op": "commit",
        "at": 1791700102,
        "rk": "rk1",
        "singles": [
         "u1"
        ],
        "expect": {
         "result": "Replay",
         "status": "OK",
         "gate": "replay-with-response",
         "replayed": true,
         "scheme_result": null
        }
       },
       {
        "op": "commit",
        "at": 1791700103,
        "rk": "rk1",
        "singles": [
         "u1"
        ],
        "expect": {
         "result": "Replay",
         "status": "OK",
         "gate": "replay-with-response",
         "replayed": true,
         "scheme_result": null
        }
       },
       {
        "op": "commit",
        "at": 1791700104,
        "rk": "rk1",
        "singles": [
         "u1"
        ],
        "expect": {
         "result": "Replay",
         "status": "OK",
         "gate": "replay-with-response",
         "replayed": true,
         "scheme_result": null
        }
       }
      ]
     },
     "result": "valid"
    },
    {
     "tcId": 2,
     "comment": "the same single use ID under another ReplayKey",
     "flags": [
      "Spent"
     ],
     "sections": [
      "6.3"
     ],
     "inputs": {
      "replay_window": 86400,
      "pending_timeout": 300,
      "steps": [
       {
        "op": "commit",
        "at": 1791700100,
        "rk": "rk1",
        "singles": [
         "u1"
        ],
        "expect": {
         "result": "New",
         "gate": "run-action"
        }
       },
       {
        "op": "settle",
        "at": 1791700101,
        "rk": "rk1",
        "status": "OK",
        "expect": {
         "settled": true
        }
       },
       {
        "op": "commit",
        "at": 1791700102,
        "rk": "rk2",
        "singles": [
         "u1"
        ],
        "expect": {
         "result": "SPENT",
         "gate": "SPENT"
        }
       }
      ]
     },
     "result": "invalid",
     "error": "SPENT",
     "errorCode": 12
    },
    {
     "tcId": 3,
     "comment": "an aborted commit consumes nothing",
     "flags": [
      "Abort"
     ],
     "sections": [
      "6.3"
     ],
     "inputs": {
      "replay_window": 86400,
      "pending_timeout": 300,
      "steps": [
       {
        "op": "commit",
        "at": 1791700100,
        "rk": "rk1",
        "singles": [
         "u1"
        ],
        "expect": {
         "result": "New",
         "gate": "run-action"
        }
       },
       {
        "op": "commit",
        "at": 1791700101,
        "rk": "rk2",
        "singles": [
         "u1",
         "u2"
        ],
        "expect": {
         "result": "SPENT",
         "gate": "SPENT"
        }
       },
       {
        "op": "commit",
        "at": 1791700102,
        "rk": "rk3",
        "singles": [
         "u2"
        ],
        "expect": {
         "result": "New",
         "gate": "run-action"
        }
       }
      ]
     },
     "result": "valid"
    },
    {
     "tcId": 4,
     "comment": "a full rate counter refuses and consumes the commit's single uses neither",
     "flags": [
      "Rate",
      "Abort"
     ],
     "sections": [
      "6.3"
     ],
     "inputs": {
      "replay_window": 86400,
      "pending_timeout": 300,
      "steps": [
       {
        "op": "commit",
        "at": 1791700100,
        "rk": "rk1",
        "counters": [
         [
          "c1",
          1
         ]
        ],
        "expect": {
         "result": "New",
         "gate": "run-action"
        }
       },
       {
        "op": "commit",
        "at": 1791700101,
        "rk": "rk2",
        "singles": [
         "u5"
        ],
        "counters": [
         [
          "c1",
          1
         ]
        ],
        "expect": {
         "result": "RATE_LIMITED",
         "gate": "RATE_LIMITED"
        }
       },
       {
        "op": "commit",
        "at": 1791700102,
        "rk": "rk3",
        "singles": [
         "u5"
        ],
        "expect": {
         "result": "New",
         "gate": "run-action"
        }
       }
      ]
     },
     "result": "valid"
    },
    {
     "tcId": 5,
     "comment": "a counter full at commit although it had room at pricing",
     "flags": [
      "Rate"
     ],
     "sections": [
      "7",
      "6.3"
     ],
     "inputs": {
      "replay_window": 86400,
      "pending_timeout": 300,
      "steps": [
       {
        "op": "commit",
        "at": 1791700100,
        "rk": "rkA",
        "singles": [
         "uA"
        ],
        "counters": [
         [
          "q1",
          1
         ]
        ],
        "expect": {
         "result": "New",
         "gate": "run-action"
        }
       },
       {
        "op": "commit",
        "at": 1791700100,
        "rk": "rkB",
        "singles": [
         "uB"
        ],
        "counters": [
         [
          "q1",
          1
         ]
        ],
        "expect": {
         "result": "RATE_LIMITED",
         "gate": "RATE_LIMITED"
        }
       }
      ]
     },
     "result": "invalid",
     "error": "RATE_LIMITED",
     "errorCode": 14
    },
    {
     "tcId": 6,
     "comment": "a replay while the first is in flight returns PENDING",
     "flags": [
      "Replay"
     ],
     "sections": [
      "6.4"
     ],
     "inputs": {
      "replay_window": 86400,
      "pending_timeout": 300,
      "steps": [
       {
        "op": "commit",
        "at": 1791700100,
        "rk": "rk1",
        "singles": [
         "u1"
        ],
        "expect": {
         "result": "New",
         "gate": "run-action"
        }
       },
       {
        "op": "commit",
        "at": 1791700101,
        "rk": "rk1",
        "singles": [
         "u1"
        ],
        "expect": {
         "result": "Replay",
         "status": "PENDING",
         "gate": "PENDING"
        }
       }
      ]
     },
     "result": "valid"
    },
    {
     "tcId": 7,
     "comment": "settle succeeds once; a second settle with another status changes nothing",
     "flags": [
      "Once"
     ],
     "sections": [
      "6.4"
     ],
     "inputs": {
      "replay_window": 86400,
      "pending_timeout": 300,
      "steps": [
       {
        "op": "commit",
        "at": 1791700100,
        "rk": "rk1",
        "singles": [
         "u1"
        ],
        "expect": {
         "result": "New",
         "gate": "run-action"
        }
       },
       {
        "op": "settle",
        "at": 1791700101,
        "rk": "rk1",
        "status": "OK",
        "expect": {
         "settled": true
        }
       },
       {
        "op": "settle",
        "at": 1791700102,
        "rk": "rk1",
        "status": "FAILED",
        "expect": {
         "settled": false
        }
       },
       {